{
  "format": "folderbase-version-v1",
  "protocol_version": "0.4",
  "folderbase_id": "folderbase_018f43c2-9a1b-7def-8123-456789abcdef",
  "version_id": "fbversion_0198ee40-a111-7aaa-8000-000000000002",
  "parents": [
    "fbversion_0198ee40-a111-7aaa-8000-000000000001"
  ],
  "created_at": "2026-07-29T00:01:00Z",
  "path_policy": {
    "format": "folderbase-portable-path-v1",
    "normalization": "NFC",
    "normalization_unicode_version": "17.0.0",
    "case_folding": "full-default",
    "case_folding_unicode_version": "9.0.0"
  },
  "root_manifest": {
    "path": ".folderbase/manifest.json",
    "object_version_id": "version_0198ee40-c333-7ccc-8000-000000000100",
    "content_sha256": "dddddddddddddddddddddddddddddddddddddddddddddddddddddddddddddddd",
    "bytes": 512
  },
  "bindings": [
    {
      "path": ".folderbaseignore",
      "object_id": "obj_0198ee40-b222-7bbb-8000-000000000008",
      "lifecycle": "live",
      "kind": "regular_file",
      "object_version_id": "version_0198ee40-c333-7ccc-8000-000000000006",
      "content_sha256": "eeeeeeeeeeeeeeeeeeeeeeeeeeeeeeeeeeeeeeeeeeeeeeeeeeeeeeeeeeeeeeee",
      "bytes": 64,
      "executable": false
    },
    {
      "path": "FOLDERBASE.md",
      "object_id": "obj_0198ee40-b222-7bbb-8000-000000000009",
      "lifecycle": "live",
      "kind": "regular_file",
      "object_version_id": "version_0198ee40-c333-7ccc-8000-000000000007",
      "content_sha256": "ffffffffffffffffffffffffffffffffffffffffffffffffffffffffffffffff",
      "bytes": 128,
      "executable": false
    },
    {
      "path": "assets",
      "object_id": "obj_0198ee40-b222-7bbb-8000-000000000001",
      "lifecycle": "live",
      "kind": "directory"
    },
    {
      "path": "bin/tool",
      "object_id": "obj_0198ee40-b222-7bbb-8000-000000000002",
      "lifecycle": "live",
      "kind": "regular_file",
      "object_version_id": "version_0198ee40-c333-7ccc-8000-000000000001",
      "content_sha256": "aaaaaaaaaaaaaaaaaaaaaaaaaaaaaaaaaaaaaaaaaaaaaaaaaaaaaaaaaaaaaaaa",
      "bytes": 10737418240,
      "executable": true
    },
    {
      "path": "docs",
      "object_id": "obj_0198ee40-b222-7bbb-8000-000000000003",
      "lifecycle": "live",
      "kind": "directory"
    },
    {
      "path": "draft.md",
      "object_id": "obj_0198ee40-b222-7bbb-8000-000000000004",
      "lifecycle": "live",
      "kind": "regular_file",
      "object_version_id": "version_0198ee40-c333-7ccc-8000-000000000002",
      "content_sha256": "bbbbbbbbbbbbbbbbbbbbbbbbbbbbbbbbbbbbbbbbbbbbbbbbbbbbbbbbbbbbbbbb",
      "bytes": 12,
      "executable": false
    },
    {
      "path": "links/readme",
      "object_id": "obj_0198ee40-b222-7bbb-8000-000000000005",
      "lifecycle": "live",
      "kind": "symlink",
      "object_version_id": "version_0198ee40-c333-7ccc-8000-000000000003",
      "target": "../readme.md",
      "target_safety": "relative-within-folderbase"
    },
    {
      "path": "readme.md",
      "object_id": "obj_0198ee40-b222-7bbb-8000-000000000006",
      "lifecycle": "live",
      "kind": "regular_file",
      "object_version_id": "version_0198ee40-c333-7ccc-8000-000000000004",
      "content_sha256": "cccccccccccccccccccccccccccccccccccccccccccccccccccccccccccccccc",
      "bytes": 42,
      "executable": false
    }
  ],
  "tombstones": [
    {
      "path": "draft.md",
      "object_id": "obj_0198ee40-b222-7bbb-8000-000000000007",
      "lifecycle": "deleted",
      "deleted_kind": "regular_file",
      "last_object_version_id": "version_0198ee40-c333-7ccc-8000-000000000005"
    },
    {
      "path": "old-assets",
      "object_id": "obj_0198ee40-b222-7bbb-8000-000000000001",
      "lifecycle": "deleted",
      "deleted_kind": "directory",
      "last_object_version_id": null
    },
    {
      "path": "old-readme.md",
      "object_id": "obj_0198ee40-b222-7bbb-8000-000000000006",
      "lifecycle": "deleted",
      "deleted_kind": "regular_file",
      "last_object_version_id": "version_0198ee40-c333-7ccc-8000-000000000004"
    }
  ],
  "exclusions": [
    {
      "path": "clients/private",
      "kind": "nested_folderbase",
      "reason": "nested-folderbase-boundary"
    },
    {
      "path": "media/master-copy.mov",
      "kind": "hard_link",
      "reason": "unsupported-v1"
    },
    {
      "path": "runtime/pipe",
      "kind": "fifo",
      "reason": "unsupported-v1"
    }
  ]
}
